genderENG,classificationENG,subclassificationENG,genderHUN,classificationHUN,subclassificationHUN,productId,similarProductsLink,mainProductsLink,productName,priceHUF,priceEUR,brand,stockStatusENG,images,color,catalogId,productDetails
women,dress,dress,női,ruha,ruha,2666542,https://www.fashiondays.hu/v/2666542/n%C5%91i-/ruh%C3%A1zat?productSlug=ejtett-v%C3%A1ll%C3%BA-l%C3%A1gy-es%C3%A9s%C5%B1-midiruha-n%C5%91i-koton&tagId=1,https://www.fashiondays.hu/p/ejtett-v%C3%A1ll%C3%BA-l%C3%A1gy-es%C3%A9s%C5%B1-midiruha-n%C5%91i-koton-p2666542-1/,Ejtett vállú lágy esésű midiruha,9999,28,KOTON,in_stock,https://fdcdn.akamaized.net/m/780x1132/products/29308/29307742/images/res_5a311c82cb1f7ca2a8b6497f58af83dd.jpg?s=ZVevVejl1Ar- https://fdcdn.akamaized.net/m/780x1132/products/29308/29307742/images/res_832dff17a1a804097adec3c4c7845f4c.jpg?s=pZhpkz36FXuy https://fdcdn.akamaized.net/m/780x1132/products/29308/29307742/images/res_a27278400ff51c634a97ff1d2d1c7bd9.jpg?s=PK1Psp8JdxIh https://fdcdn.akamaized.net/m/780x1132/products/29308/29307742/images/res_e42141447373dee936b9f6e7c7ba6752.jpg?s=khK-vQxS-oFG,zöld,0YAK88103PW-890,Leírás Szín: zöld Stílus: hétköznapi Anyag: viszkóz Minta: nincs Szabás: laza$ aszimmetrikus Hossza: midi Ujjak hossza: rövid Részletek: lágy esésű anyag$ megkötő a derékrészen Összetétel Anyag: 100% viszkóz Termékszám 0YAK88103PW-890
women,dress,dress,női,ruha,ruha,2666518,https://www.fashiondays.hu/v/2666518/n%C5%91i-/ruh%C3%A1zat?productSlug=vir%C3%A1gmint%C3%A1s-midiruha-n%C5%91i-koton&tagId=1,https://www.fashiondays.hu/p/vir%C3%A1gmint%C3%A1s-midiruha-n%C5%91i-koton-p2666518-1/,Virágmintás midiruha,9999,28,KOTON,in_stock,https://fdcdn.akamaized.net/m/780x1132/products/29308/29307481/images/res_c8a6e436a410431df8ae36a91eefea18.jpg?s=KN3wc4OjD9SE https://fdcdn.akamaized.net/m/780x1132/products/29308/29307481/images/res_392b2a4a9d7f11eb10102b9d4637ebf0.jpg?s=_AyhAX3qTAC2 https://fdcdn.akamaized.net/m/780x1132/products/29308/29307481/images/res_098f81e2edc313c471a7691c4ee838bb.jpg?s=C-1waaDXTov9 https://fdcdn.akamaized.net/m/780x1132/products/29308/29307481/images/res_c43f696ac97e50cecbc8881cd294b17b.jpg?s=H6gqmkmy1ZM5,fehér?téglavörös,0YAK88088PW-33B,Leírás Szín: fehér$ téglavörös Stílus: hétköznapi Anyag: viszkóz Minta: virágminta Szabás: egyenes Hossza: midi Nyakkivágás: V alakú Ujjak hossza: rövid Rögzítés: gombos Összetétel Anyag: 100% viszkóz Termékszám 0YAK88088PW-33B
women,dress,dress,női,ruha,ruha,2652574,https://www.fashiondays.hu/v/2652574/n%C5%91i-/ruh%C3%A1zat?productSlug=l%C3%A1gy-es%C3%A9s%C5%B1-maxiruha-csipkebet%C3%A9tekkel-n%C5%91i-esprit&tagId=1,https://www.fashiondays.hu/p/l%C3%A1gy-es%C3%A9s%C5%B1-maxiruha-csipkebet%C3%A9tekkel-n%C5%91i-esprit-p2652574-1/,Lágy esésű maxiruha csipkebetétekkel,27899,78.12,Esprit,in_stock,https://fdcdn.akamaized.net/m/780x1132/products/27368/27367840/images/res_9d2d50f7e23bbef20379eb937dd967cd.jpg?s=aES0HuPE_spF https://fdcdn.akamaized.net/m/780x1132/products/27368/27367840/images/res_b1d5f2a1633ed19e6c41fde919165380.jpg?s=YNyskb0M51MT https://fdcdn.akamaized.net/m/780x1132/products/27368/27367840/images/res_2dbfb8b6f491b4798122e10f8293a8e8.jpg?s=JOH4l9U67fNX https://fdcdn.akamaized.net/m/780x1132/products/27368/27367840/images/res_8fba5d813aa3636cbcb27fcb7224d14b.jpg?s=Pl2n3DXX6zs0 https://fdcdn.akamaized.net/m/780x1132/products/27368/27367840/images/res_fbbb72791b10a9118125ce1ce84d2b81.jpg?s=TGbqza4JEev_,fekete,040EO1E324-001,Leírás Szín: fekete Stílus: elegáns Anyag: szintetikus szálak Minta: nincs Szabás: bővülő Hossz: maxi Nyakkivágás: amerikai - magasan záródó$ pántos Ujjak hossza: ujjatlan Részletek: csipkebetétek Rögzítés: cipzáros Összetétel Anyag: 100% újrahasznosított poliészter Bélés: 100% poliészter Szegélyek: 70% pamut$ 30% poliamid Modellinformáció A modell 36-os (=S) méretű terméket visel$ európai méretezés szerint. Méretei: 180 cm$ mellbőség: 86 cm$ derékbőség: 65 cm$ csípő: 94 cm Termékszám 040EO1E324-001
women,dress,dress,női,ruha,ruha,2652500,https://www.fashiondays.hu/v/2652500/n%C5%91i-/ruh%C3%A1zat?productSlug=p%C3%B6tty%C3%B6s-maxiruha-%C3%A1tlapolt-v-kiv%C3%A1g%C3%A1s%C3%BA-nyakr%C3%A9sszel-n%C5%91i-esprit&tagId=1,https://www.fashiondays.hu/p/p%C3%B6tty%C3%B6s-maxiruha-%C3%A1tlapolt-v-kiv%C3%A1g%C3%A1s%C3%BA-nyakr%C3%A9sszel-n%C5%91i-esprit-p2652500-1/,Pöttyös maxiruha átlapolt V-kivágású nyakrésszel,23099,64.68,Esprit,in_stock,https://fdcdn.akamaized.net/m/780x1132/products/27368/27367674/images/res_2cc8ac24b2c0d80ded95b0f82abe2d24.jpg?s=UUEMx_LQnLKk https://fdcdn.akamaized.net/m/780x1132/products/27368/27367674/images/res_73029e8a3bff08307750527c0bbb6869.jpg?s=MtQKg0sq4l8j https://fdcdn.akamaized.net/m/780x1132/products/27368/27367674/images/res_a662f9a204468da61371c0ce6004d130.jpg?s=aoT6tnKTBkyT https://fdcdn.akamaized.net/m/780x1132/products/27368/27367674/images/res_66caaffad16b3258bf80a73a1c21caf9.jpg?s=169UkcEToO-7,mentazöld,040EO1E330-343,Leírás Szín: mentazöld Stílus: hétköznapi Anyag: szintetikus szálak Minta: pöttyös Szabás: A-vonalú Hossz: maxi Nyakkivágás: átlapolós V-kivágás Ujjak hossza: ujjatlan Összetétel Anyag: 100% poliészter Bélés: 100% poliészter Modellinformáció A modell S/36-os méretű terméket visel$ EU méretezés szerint. Méretei: 180 cm$ mellbőség: 86 cm$ derékbőség: 65 cm$ csípő: 94 cm Termékszám 040EO1E330-343
women,dress,dress,női,ruha,ruha,2652486,https://www.fashiondays.hu/v/2652486/n%C5%91i-/ruh%C3%A1zat?productSlug=p%C3%B6tty%C3%B6s-maxiruha-%C3%A1tlapolt-v-kiv%C3%A1g%C3%A1s%C3%BA-nyakr%C3%A9sszel-n%C5%91i-esprit&tagId=1,https://www.fashiondays.hu/p/p%C3%B6tty%C3%B6s-maxiruha-%C3%A1tlapolt-v-kiv%C3%A1g%C3%A1s%C3%BA-nyakr%C3%A9sszel-n%C5%91i-esprit-p2652486-1/,Pöttyös maxiruha átlapolt V-kivágású nyakrésszel,23099,64.68,Esprit,in_stock,https://fdcdn.akamaized.net/m/780x1132/products/27368/27367680/images/res_f35b465792b0aae6d120eb16418795b8.jpg?s=u-k7tyEO2Fgc https://fdcdn.akamaized.net/m/780x1132/products/27368/27367680/images/res_e948504c9eb1ff436a2e084cc559e78b.jpg?s=zVN-cvc0bcHN https://fdcdn.akamaized.net/m/780x1132/products/27368/27367680/images/res_b6e00634378949b8cc1a40c659f81ec3.jpg?s=o1O-VSZp-Jgw,tengerészkék?szürke,040EO1E330-403,Leírás Szín: tengerészkék$ szürke Stílus: hétköznapi Anyag: szintetikus szálak Minta: pöttyös Szabás: A-vonalú Hossz: maxi Nyakkivágás: átlapolós V-kivágás Ujjak hossza: ujjatlan Összetétel Anyag: 100% poliészter Bélés: 100% poliészter Modellinformáció A modell 36-os (=S) méretű terméket visel$ európai méretezés szerint. Méretei: 180 cm$ mellbőség: 86 cm$ derékbőség: 65 cm$ csípő: 94 cm Termékszám 040EO1E330-403
women,dress,dress,női,ruha,ruha,2652527,https://www.fashiondays.hu/v/2652527/n%C5%91i-/ruh%C3%A1zat?productSlug=sifonruha-megk%C3%B6t%C5%91vel-n%C5%91i-esprit&tagId=1,https://www.fashiondays.hu/p/sifonruha-megk%C3%B6t%C5%91vel-n%C5%91i-esprit-p2652527-1/,Sifonruha megkötővel,16299,45.64,Esprit,in_stock,https://fdcdn.akamaized.net/m/780x1132/products/27368/27367698/images/res_84e9103806b85a8b48c4d2aa7c80ebb4.jpg?s=Z5Z1xnKNgnuk https://fdcdn.akamaized.net/m/780x1132/products/27368/27367698/images/res_24e30ec784cfbb99e9ad643a72d74f85.jpg?s=JlEAOgDGny1B https://fdcdn.akamaized.net/m/780x1132/products/27368/27367698/images/res_3e154ac2978b3778a0ac2c64b344118d.jpg?s=FTr3sjIhL_1X https://fdcdn.akamaized.net/m/780x1132/products/27368/27367698/images/res_dec36c041e42c4a0ddf282fd8addfc7d.jpg?s=22w1UhkDkgtb,mandarinszín,040EO1E335-825,Leírás Szín: mandarinszín Stílus: hétköznapi Anyag: sifon Minta: nincs Szabás: egyenes Hossza: mini Nyakkivágás: kerek$ V-hasítékkal Ujjak: félig áttetsző Ujjak hossza: hosszú Rögzítés: lágy esésű anyag$ megkötő Összetétel Anyag: 100% poliészter Bélés: 100% poliészter Modellinformáció A modell 36-os (=S) méretű terméket visel$ európai méretezés szerint. Méretei: 180 cm$ mellbőség: 86 cm$ derékbőség: 65 cm$ csípő: 94 cm Termékszám 040EO1E335-825
women,dress,dress,női,ruha,ruha,2652454,https://www.fashiondays.hu/v/2652454/n%C5%91i-/ruh%C3%A1zat?productSlug=b%C5%91v%C3%BCl%C5%91-fazon%C3%BA-ruha-csipkebet%C3%A9tekkel-n%C5%91i-esprit&tagId=1,https://www.fashiondays.hu/p/b%C5%91v%C3%BCl%C5%91-fazon%C3%BA-ruha-csipkebet%C3%A9tekkel-n%C5%91i-esprit-p2652454-1/,Bővülő fazonú ruha csipkebetétekkel,20399,57.12,Esprit,in_stock,https://fdcdn.akamaized.net/m/780x1132/products/27368/27367881/images/res_65d388d64a315f7c46d2d8fa59934d00.jpg?s=AYsd8UfAMnoX https://fdcdn.akamaized.net/m/780x1132/products/27368/27367881/images/res_aa48dc9b964deea6ab569e5fa726334b.jpg?s=m1HHDSW-Cz_c https://fdcdn.akamaized.net/m/780x1132/products/27368/27367881/images/res_4f151b9e9fc490f0676f2678415ba837.jpg?s=BB4u9TohuGTf https://fdcdn.akamaized.net/m/780x1132/products/27368/27367881/images/res_2a270bdbf87c970e639a57aa4fff2dfd.jpg?s=25e4axKRqzW3,barackszín,040EO1E342-695,Leírás Szín: barackszín Stílus: hétköznapi Anyag: szintetikus szálak Minta: nincs Szabás: bővülő Hossza: mini Nyakkivágás: kerek Ujjak hossza: ujjatlan Részletek: csipkebetétek$ lágy esésű anyag Rögzítés: fűzős$ cipzáros$ gombos Összetétel Anyag: 100% poliészter Bélés: 100% poliészter Szegélyek: 70% pamut$ 30% poliamid Modellinformáció A modell S/36-os méretű terméket visel$ EU méretezés szerint. Méretei: 180 cm$ mellbőség: 86 cm$ derékbőség: 65 cm$ csípő: 94 cm Termékszám 040EO1E342-695
women,dress,dress,női,ruha,ruha,2666105,https://www.fashiondays.hu/v/2666105/n%C5%91i-/ruh%C3%A1zat?productSlug=lentartalm%C3%BA-p%C3%B6tty%C3%B6s-ruha-n%C5%91i-marks-spencer&tagId=1,https://www.fashiondays.hu/p/lentartalm%C3%BA-p%C3%B6tty%C3%B6s-ruha-n%C5%91i-marks-spencer-p2666105-1/,Lentartalmú pöttyös ruha,11699,32.76,Marks & Spencer,in_stock,https://fdcdn.akamaized.net/m/780x1132/products/29541/29540788/images/res_3f56784756502bc3b9a6e773d726511e.jpg?s=McuTpr2Iohg5 https://fdcdn.akamaized.net/m/780x1132/products/29541/29540788/images/res_b419ab64b013d709cc4f18d037cad4ae.jpg?s=sP0pZC7hXKkt https://fdcdn.akamaized.net/m/780x1132/products/29541/29540788/images/res_26f45eb2824a8805652b51b02b457145.jpg?s=TIuC8kPFoT3z https://fdcdn.akamaized.net/m/780x1132/products/29541/29540788/images/res_9f00bce2ee4cf9159dd64680b9dc9bde.jpg?s=8r--l6y_-HDc https://fdcdn.akamaized.net/m/780x1132/products/29541/29540788/images/res_ceec581f1b6b27ddac7a076a1b83fbf6.jpg?s=HV6XUPTQD9UI,melange kék,T42-7672-ZJ,Leírás Szín: melange kék Stílus: hétköznapi Anyag: lenvászon$ viszkóz Minta: pöttyös Szabás: egyenes Hossza: mini Nyakkivágás: kerek$ V-hasítékkal Ujjak hossza: ujjatlan Technológia: Comfort™ Összetétel Anyag: 53% len$ 47% viszkóz Termékszám T42-7672-ZJ
women,dress,dress,női,ruha,ruha,2652336,https://www.fashiondays.hu/v/2652336/n%C5%91i-/ruh%C3%A1zat?productSlug=lentartalm%C3%BA-ingruha-n%C5%91i-esprit&tagId=1,https://www.fashiondays.hu/p/lentartalm%C3%BA-ingruha-n%C5%91i-esprit-p2652336-1/,Lentartalmú ingruha,16299,45.64,Esprit,in_stock,https://fdcdn.akamaized.net/m/780x1132/products/27367/27366806/images/res_04d1442eb6d2b0542eef904c1f254cc3.jpg?s=htCdwMkkQqqi https://fdcdn.akamaized.net/m/780x1132/products/27367/27366806/images/res_997618b19621a6ba1f03c414964eedbd.jpg?s=8Uv6gOiO9CVr https://fdcdn.akamaized.net/m/780x1132/products/27367/27366806/images/res_52d1d16928ba4b62cf63067c9306832b.jpg?s=iuVVfXeasx2b https://fdcdn.akamaized.net/m/780x1132/products/27367/27366806/images/res_8412f7e0f3f49e52467ed8e456677f05.jpg?s=TEpJZyK2W9U8,púderkék?fehér,040EE1E329-443,Leírás Szín: púderkék$ fehér Stílus: hétköznapi Anyag: pamut$ lenvászon Minta: csíkos Szabás: egyenes Hossza: midi Nyakkivágás: állógallér$ V-hasítékkal Ujjak: állítható$ gombos Ujjak hossza: hosszú Zsebek: 2 zseb az oldalán Részletek: vékony$ oldalhasítékok$ lekerekített alsó szegély$ levehető megkötő a derékrészen Rögzítés: gombos Összetétel Anyag: 55% len$ 45% pamut Modellinformáció A modell S (=36) méretű terméket visel$ EU méretezés szerint. Méretei: 180 cm$ mellbőség: 86 cm$ derékbőség: 65 cm$ csípő: 94 cm Termékszám 040EE1E329-443
women,dress,dress,női,ruha,ruha,2676365,https://www.fashiondays.hu/v/2676365/n%C5%91i-/ruh%C3%A1zat?productSlug=ruha-aszimmetrikus-als%C3%B3-szeg%C3%A9llyel-n%C5%91i-format-lady&tagId=1,https://www.fashiondays.hu/p/ruha-aszimmetrikus-als%C3%B3-szeg%C3%A9llyel-n%C5%91i-format-lady-p2676365-1/,Ruha aszimmetrikus alsó szegéllyel,10399,29.12,Format Lady,in_stock,https://fdcdn.akamaized.net/m/780x1132/products/29933/29932447/images/res_b6566bcf367c9229036423674fef612d.jpg?s=yHuP3dBb95Yu https://fdcdn.akamaized.net/m/780x1132/products/29933/29932447/images/res_e6ed788cb4c0d4693411b655595db9b6.jpg?s=gSXzUYVdLpUK https://fdcdn.akamaized.net/m/780x1132/products/29933/29932447/images/res_de401cf6270659bc2e1e7d8164f435b5.jpg?s=yx_M3MyY4x3X https://fdcdn.akamaized.net/m/780x1132/products/29933/29932447/images/res_98eb4a236b7c64637147450e09c5c5a0.jpg?s=bUn3iAgwVLGH,kék?fekete?szürke,ROC-I0-012-GRI,Leírás Szín: kék$ fekete$ szürke Stílus: hétköznapi Anyag: viszkóz Minta: absztrakt Fazon: normál$ aszimmetrikus Hossza: mini Nyakkivágás: kámzsa Ujjak hossza: háromnegyedes Részletek: aszimmetrikus alsó szegély Összetétel Anyag: 95% viszkóz$ 5% elasztán Termékszám ROC-I0-012-GRI
women,dress,dress,női,ruha,ruha,2676336,https://www.fashiondays.hu/v/2676336/n%C5%91i-/ruh%C3%A1zat?productSlug=b%C5%91v%C3%BCl%C5%91-fazon%C3%BA-ruha-megk%C3%B6t%C5%91vel-n%C5%91i-format-lady&tagId=1,https://www.fashiondays.hu/p/b%C5%91v%C3%BCl%C5%91-fazon%C3%BA-ruha-megk%C3%B6t%C5%91vel-n%C5%91i-format-lady-p2676336-1/,Bővülő fazonú ruha megkötővel,14799,41.44,Format Lady,in_stock,https://fdcdn.akamaized.net/m/780x1132/products/29933/29932425/images/res_a519aca5ab16a595cc1379c721667a4d.jpg?s=qgJmjboOoMcY https://fdcdn.akamaized.net/m/780x1132/products/29933/29932425/images/res_d8d0f02c6dd17d8adf4e44a42f1edae0.jpg?s=PXDIKis1HRL6 https://fdcdn.akamaized.net/m/780x1132/products/29933/29932425/images/res_3a30d5bd24d538783a57650cc271032c.jpg?s=yXJLiZTFcVCm https://fdcdn.akamaized.net/m/780x1132/products/29933/29932425/images/res_7e19fafb6994867d4e52d726b8a5d69c.jpg?s=eZpw3w49MA9O,tengerészkék?sárga?piros,ROC-I0-014-MOV,Leírás Szín: tengerészkék$ sárga$ piros Stílus: hétköznapi Anyag: viszkóz Minta: etno minta Szabás: bővülő Hossza: mini Nyakkivágás: V-alakú Ujjak hossza: rövid Derékrész: megkötős Összetétel Anyag: 100% viszkóz Termékszám ROC-I0-014-MOV
women,dress,dress,női,ruha,ruha,2676341,https://www.fashiondays.hu/v/2676341/n%C5%91i-/ruh%C3%A1zat?productSlug=mint%C3%A1s-ruha-n%C5%91i-format-lady&tagId=1,https://www.fashiondays.hu/p/mint%C3%A1s-ruha-n%C5%91i-format-lady-p2676341-1/,Mintás ruha,11799,33.04,Format Lady,in_stock,https://fdcdn.akamaized.net/m/780x1132/products/29933/29932407/images/res_f077fc70d7c469ce17e7d7f9ffd09332.jpg?s=K2CYfPrZDLIj https://fdcdn.akamaized.net/m/780x1132/products/29933/29932407/images/res_629296570e8e22fcbfbcbb84f832c0bf.jpg?s=x-TmsXu9huff https://fdcdn.akamaized.net/m/780x1132/products/29933/29932408/images/res_c24d25e584dd55a61fc05dbfbacb1e44.jpg?s=5TRx4jX3PPqp,tengerészkék?fehér,CAM-I0-001-BLEU,Leírás Szín: tengerészkék$ fehér Stílus: hétköznapi Anyag: viszkóz Minta: többféle különböző minta Szabás: egyenes Hossza: mini Nyakkivágás: kerek$ V-hasítékkal Ujjak hossza: háromnegyedes Részletek: gombos ingnyílás Összetétel Anyag: 100% viszkóz Termékszám CAM-I0-001-BLEU
women,dress,dress,női,ruha,ruha,2665994,https://www.fashiondays.hu/v/2665994/n%C5%91i-/ruh%C3%A1zat?productSlug=lentartalm%C3%BA-p%C3%B6tty%C3%B6s-ruha-n%C5%91i-marks-spencer&tagId=1,https://www.fashiondays.hu/p/lentartalm%C3%BA-p%C3%B6tty%C3%B6s-ruha-n%C5%91i-marks-spencer-p2665994-1/,Lentartalmú pöttyös ruha,11699,32.76,Marks & Spencer,in_stock,https://fdcdn.akamaized.net/m/780x1132/products/29541/29540796/images/res_e3562dd7fc27ad7855dbc35c87ec6d1e.jpg?s=1VgsyjGD98hJ https://fdcdn.akamaized.net/m/780x1132/products/29541/29540796/images/res_9bd9ffbd8477ffa141837e9428b98669.jpg?s=LHqp1xsiXwvO,melange szürke?fehér,T42-7674-T4,Leírás Szín: melange szürke$ fehér Stílus: hétköznapi Anyag: lenvászon$ viszkóz Minta: pöttyös Szabás: egyenes Hossza: mini Nyakkivágás: kerek$ V-hasítékkal Ujjak hossza: ujjatlan Technológia: Comfort™ Összetétel Anyag: 53% len$ 47% viszkóz Termékszám T42-7674-T4
women,dress,dress,női,ruha,ruha,2651823,https://www.fashiondays.hu/v/2651823/n%C5%91i-/ruh%C3%A1zat?productSlug=egyenes-fazon%C3%BA-v-nyak%C3%BA-ruha-n%C5%91i-esprit&tagId=1,https://www.fashiondays.hu/p/egyenes-fazon%C3%BA-v-nyak%C3%BA-ruha-n%C5%91i-esprit-p2651823-1/,Egyenes fazonú V-nyakú ruha,16299,45.64,Esprit,in_stock,https://fdcdn.akamaized.net/m/780x1132/products/27368/27367578/images/res_29a5b6f81dbec70d997b27234ae410f3.jpg?s=YgeB1-R66Jo8 https://fdcdn.akamaized.net/m/780x1132/products/27368/27367578/images/res_93d8f68fd5ffd54fbae4ade28639d60b.jpg?s=QAn6J1vRKafY https://fdcdn.akamaized.net/m/780x1132/products/27368/27367578/images/res_65333ca3b75f2386fcf5f9b805793e15.jpg?s=SaN8iW62hNZL https://fdcdn.akamaized.net/m/780x1132/products/27368/27367578/images/res_7364738c0d26aa6dd64c1043a09439db.jpg?s=P9aMxF_Bamzp,mandarinszín,990EO1E303-825,Leírás Szín: mandarinszín Stílus: hétköznapi$ irodai Anyag: szintetikus szálak Minta: nincs Szabás: egyenes Hossza: midi Nyakkivágás: V alakú Ujjak hossza: középhosszú Rögzítés: cipzáros Összetétel Anyag: 61% poliészter$ 39% elasztomultiészter Bélés: 100% poliészter Modellinformáció A modell 36-os (=S) méretű terméket visel$ európai méretezés szerint. Méretei: 180 cm$ mellbőség: 86 cm$ derékbőség: 65 cm$ csípő: 94 cm Termékszám 990EO1E303-825
women,dress,dress,női,ruha,ruha,2662770,https://www.fashiondays.hu/v/2662770/n%C5%91i-/ruh%C3%A1zat?productSlug=bandage-ruha-n%C5%91i-guess-by-marciano&tagId=1,https://www.fashiondays.hu/p/bandage-ruha-n%C5%91i-guess-by-marciano-p2662770-1/,Bandage ruha,73499,205.8,GUESS BY MARCIANO,in_stock,https://fdcdn.akamaized.net/m/780x1132/products/27715/27714100/images/res_262f2990bbdd7f625d89cecb8a2fdad1.jpg?s=dZmdAhzzJGU8 https://fdcdn.akamaized.net/m/780x1132/products/27715/27714100/images/res_349aa3c8c93dcc6d7127e6d234930b52.jpg?s=cFFke5Jhs8ip https://fdcdn.akamaized.net/m/780x1132/products/27715/27714100/images/res_a4a9a821e910b55619e592d7c578a158.jpg?s=IvfitzFqd-qZ,indigókék,02G738-5012Z-G4J1,Leírás Szín: indigókék Stílus: elegáns Anyag: szintetikus anyag$ viszkóz Minta: nincs Fazon: bodycon - testet követő$ szűkített fazon Hossz: maxi Nyakkivágás: szív alakú Pántok: egy állítható és levehető Részletek: aszimmetrikus alsó szegély Rögzítés: cipzáros Összetétel Anyag: 83% viszkóz$ 16% poliészter$ 1% elasztán Modellinformáció A modell S-es méretű terméket visel. Méretei: magasság: 180 cm$ mellbőség: 86 cm$ derékbőség: 65 cm$ csípő: 94 cm Termékszám 02G738-5012Z-G4J1
women,dress,dress,női,ruha,ruha,2670463,https://www.fashiondays.hu/v/2670463/n%C5%91i-/ruh%C3%A1zat?productSlug=bobo-b%C5%91v%C3%BCl%C5%91-fazon%C3%BA-ruha-n%C5%91i-mango&tagId=1,https://www.fashiondays.hu/p/bobo-b%C5%91v%C3%BCl%C5%91-fazon%C3%BA-ruha-n%C5%91i-mango-p2670463-1/,Bobo bővülő fazonú ruha,12999,36.4,Mango,in_stock,https://fdcdn.akamaized.net/m/780x1132/products/29761/29760568/images/res_00df22c8a8d0e1713a5b2602aead69b3.jpg?s=a7BEml50NRL3 https://fdcdn.akamaized.net/m/780x1132/products/29761/29760568/images/res_61a4383262eda5c80f48146711ce3fb9.jpg?s=fEh5FoXHg7ma https://fdcdn.akamaized.net/m/780x1132/products/29761/29760568/images/res_a2acb5bb019473b26e309f62c9ed79dc.jpg?s=2jD3qIRHw0oI https://fdcdn.akamaized.net/m/780x1132/products/29761/29760568/images/res_188c0ba45ddf13b4a86bc15076cf963c.jpg?s=3wtMLDj4iiVl https://fdcdn.akamaized.net/m/780x1132/products/29761/29760568/images/res_8b990e967d15d7f7b1a229aac3f08929.jpg?s=R0ICHHSorDIV https://fdcdn.akamaized.net/m/780x1132/products/29761/29760568/images/res_11e9367fd7e9b71ed51950b8ce777839.jpg?s=pH59-Aj8rdW1 https://fdcdn.akamaized.net/m/780x1132/products/29761/29760568/images/res_eb517bc40d8b8c73efde94577874046a.jpg?s=7znKW_9VTD9E,fekete,67065971-99,Leírás Szín: fekete Stílus: hétköznapi Anyag: viszkóz$ szintetikus szálak Minta: nincs Szabás: bővülő Hossza: mini Nyakkivágás: fodros Ujjak hossza: hosszú Részletek: fodros részletek$ gombos nyakkivágás$ texturált hatás$ lágy esésű anyag Összetétel Anyag: 88% poliészter$ 12% viszkóz Bélés: 100% poliészter Termékszám 67065971-99
women,dress,dress,női,ruha,ruha,2685429,https://www.fashiondays.hu/v/2685429/n%C5%91i-/ruh%C3%A1zat?productSlug=alba-ejtett-v%C3%A1ll%C3%BA-ruha-%C3%A1llatmint%C3%A1val-n%C5%91i-mango&tagId=1,https://www.fashiondays.hu/p/alba-ejtett-v%C3%A1ll%C3%BA-ruha-%C3%A1llatmint%C3%A1val-n%C5%91i-mango-p2685429-1/,Alba ejtett vállú ruha állatmintával,12999,36.4,Mango,limited_quantity,https://fdcdn.akamaized.net/m/780x1132/products/30051/30050150/images/res_28c58f6b3fb2860b36181ae524e87a8d.jpg?s=Elc_nuka28V4 https://fdcdn.akamaized.net/m/780x1132/products/30051/30050150/images/res_eb68138925e5c2d0d51ebe15fdfe4d61.jpg?s=f7KszwL0iLVk https://fdcdn.akamaized.net/m/780x1132/products/30051/30050150/images/res_d2f33a395c22516593f103a15a68a703.jpg?s=I_IawI54Xo-I https://fdcdn.akamaized.net/m/780x1132/products/30051/30050150/images/res_ee975e95c043c23f0547118c3392ebc4.jpg?s=rhE8ZSguEea1,sötétpiros?fehér,67017693-76,Leírás Szín: sötétpiros$ fehér Stílus: hétköznapi Anyag: organikus pamut Minta: állatmintás Fazon: laza Hossza: mini Ujjak hossza: háromnegyedes Kollekció: Committed Összetétel Anyag: 100% pamut Termékszám 67017693-76
women,dress,dress,női,ruha,ruha,2685424,https://www.fashiondays.hu/v/2685424/n%C5%91i-/ruh%C3%A1zat?productSlug=boho-b%C5%91v%C3%BCl%C5%91-ruha-fodros-ujjakkal-n%C5%91i-mango&tagId=1,https://www.fashiondays.hu/p/boho-b%C5%91v%C3%BCl%C5%91-ruha-fodros-ujjakkal-n%C5%91i-mango-p2685424-1/,Boho bővülő ruha fodros ujjakkal,15999,44.8,Mango,limited_quantity,https://fdcdn.akamaized.net/m/780x1132/products/30051/30050154/images/res_7ac1aee0d6e78c44aff435c6947c477a.jpg?s=h1crVqacP87P https://fdcdn.akamaized.net/m/780x1132/products/30051/30050154/images/res_979813de1fa5c0011057a00fbd52e852.jpg?s=cyyieKIZahrh https://fdcdn.akamaized.net/m/780x1132/products/30051/30050154/images/res_67418e2d7fb89b7ace6a53b7fc5fa9f6.jpg?s=76p4ARAaW1n0 https://fdcdn.akamaized.net/m/780x1132/products/30051/30050154/images/res_7cc54de910dbb0e1195f49ad0e29b6e7.jpg?s=s5SUDs5R3YP0,fekete?piros?fehér,67017695-99,Leírás Szín: fekete$ piros$ fehér Stílus: hétköznapi Anyag: szintetikus szálak Minta: virágminta Szabás: bővülő Hossza: mini Nyakkivágás: kerek Ujjak: fodros Ujjak hossza: rövid Részletek: lágy esésű anyag Rögzítés: csepp alakú kivágás Kollekció: Committed Összetétel Anyag: 50% újrahasznosított poliészter$ 45% poliészter$ 5% fém Bélés: 100% poliészter Termékszám 67017695-99
women,dress,dress,női,ruha,ruha,2675058,https://www.fashiondays.hu/v/2675058/n%C5%91i-/ruh%C3%A1zat?productSlug=ejtett-v%C3%A1ll%C3%BA-ruha-aszimmetrikus-als%C3%B3-szeg%C3%A9llyel-n%C5%91i-bluzat&tagId=1,https://www.fashiondays.hu/p/ejtett-v%C3%A1ll%C3%BA-ruha-aszimmetrikus-als%C3%B3-szeg%C3%A9llyel-n%C5%91i-bluzat-p2675058-1/,Ejtett vállú ruha aszimmetrikus alsó szegéllyel,55900,156.52,BLUZAT,in_stock,https://fdcdn.akamaized.net/m/780x1132/products/29958/29957308/images/res_22d847f9e3d9a15cbb38fae9d4eba517.jpg?s=a_T6bFwBSrXI https://fdcdn.akamaized.net/m/780x1132/products/29958/29957308/images/res_0a47bd34e5cd7c1bc92b9d98d30d7f93.jpg?s=PobkXaESxLgI https://fdcdn.akamaized.net/m/780x1132/products/29958/29957308/images/res_2c7507c26b4b1046d82eea676c286e9b.jpg?s=ZEbpciSGOimV https://fdcdn.akamaized.net/m/780x1132/products/29958/29957308/images/res_1e067cceb848c6a6a3c224efb7975304.jpg?s=jw-StUQwRmrc,lila,BLZ20S052-LILA,Leírás Szín: lila Stílus: hétköznapi Anyag: pamut$ szintetikus szálak Minta: nincs Szabás: bővülő$ aszimmetrikus$ ejtett vállú Hossza: midi Ujjak hossza: hosszú Részletek: bővülő alsó szegély$ megkötővel állítható derékrész Összetétel Anyag: 95% pamut$ 5% elasztán Termékszám BLZ20S052-LILA
women,dress,dress,női,ruha,ruha,2675036,https://www.fashiondays.hu/v/2675036/n%C5%91i-/ruh%C3%A1zat?productSlug=ejtett-v%C3%A1ll%C3%BA-ruha-aszimmetrikus-als%C3%B3-szeg%C3%A9llyel-n%C5%91i-bluzat&tagId=1,https://www.fashiondays.hu/p/ejtett-v%C3%A1ll%C3%BA-ruha-aszimmetrikus-als%C3%B3-szeg%C3%A9llyel-n%C5%91i-bluzat-p2675036-1/,Ejtett vállú ruha aszimmetrikus alsó szegéllyel,55900,156.52,BLUZAT,in_stock,https://fdcdn.akamaized.net/m/780x1132/products/29958/29957304/images/res_d66f57b2911876fc7da9a02c7d7a5a04.jpg?s=G4fFC8k6g4aH https://fdcdn.akamaized.net/m/780x1132/products/29958/29957304/images/res_88a85c4eca499dd1c0062906df4f36df.jpg?s=td6zisoLwr6A https://fdcdn.akamaized.net/m/780x1132/products/29958/29957304/images/res_aebbca59768620e1d2b3cea052295c16.jpg?s=XyAeo1bo5znf https://fdcdn.akamaized.net/m/780x1132/products/29958/29957304/images/res_ac45f2ec1850e14822c23306ecb1f7aa.jpg?s=XFG4nfT2Nr6X,drapp,BLZ20S052-GREY,Leírás Színe: drapp Stílus: hétköznapi Anyag: pamut Minta: nincs Szabás: normál fazon$ ejtett vállak Hossza: midi Ujjak hossza: hosszú Összetétel Anyag: 95% pamut$ 5% elasztán Termékszám BLZ20S052-GREY
