genderENG,classificationENG,subclassificationENG,genderHUN,classificationHUN,subclassificationHUN,productId,similarProductsLink,mainProductsLink,productName,priceHUF,priceEUR,brand,stockStatusENG,images,color,catalogId,productDetails
women,dress,dress,női,ruha,ruha,2660762,https://www.fashiondays.hu/v/2660762/n%C5%91i-/ruh%C3%A1zat?productSlug=lentartalm%C3%BA-%C3%A1tlapol%C3%B3s-miniruha-n%C5%91i-banana-republic&tagId=1,https://www.fashiondays.hu/p/lentartalm%C3%BA-%C3%A1tlapol%C3%B3s-miniruha-n%C5%91i-banana-republic-p2660762-1/,Lentartalmú átlapolós miniruha,27299,76.44,Banana Republic,in_stock,https://fdcdn.akamaized.net/m/780x1132/products/29302/29301604/images/res_a5ca818ffa1a464eae22ed1cca0c3a69.jpg?s=41vHlhLpZJhO https://fdcdn.akamaized.net/m/780x1132/products/29302/29301604/images/res_d077fa38893d71fcda975230fe1dc9a7.jpg?s=R6dpKM2DYnhA https://fdcdn.akamaized.net/m/780x1132/products/29302/29301604/images/res_0bcf24f71ccdede70cab0098699d77d9.jpg?s=IRKRkFAcKePv https://fdcdn.akamaized.net/m/780x1132/products/29302/29301604/images/res_a1e4de796d229befa04b72247904802a.jpg?s=P0_UkEXyg6UF,szalmasárga,000548063-835,Leírás Szín: szalmasárga Stílus: hétköznapi Anyag: pamut$ lenvászon Minta: nincs Szabás: egyenes Hossza: mini Nyakkivágás: átlapolós V-kivágás Pántok: 2 állítható Ujjak hossza: ujjatlan Rögzítés: gombos Összetétel Anyag: 55% len$ 42% pamut$ 3% elasztán Bélés: 100% pamut Modellinformáció A modell 4 (=S) méretű terméket visel$ amerikai méretezés szerint. Méretei: 180 cm$ mellbőség: 86 cm$ derékbőség: 65 cm$ csípő: 94 cm Termékszám 000548063-835
women,dress,dress,női,ruha,ruha,2665476,https://www.fashiondays.hu/v/2665476/n%C5%91i-/ruh%C3%A1zat?productSlug=maxiruha-amerikai-nyakkiv%C3%A1g%C3%A1ssal-n%C5%91i-guess-jeans&tagId=1,https://www.fashiondays.hu/p/maxiruha-amerikai-nyakkiv%C3%A1g%C3%A1ssal-n%C5%91i-guess-jeans-p2665476-1/,Maxiruha amerikai nyakkivágással,35199,98.56,GUESS JEANS,in_stock,https://fdcdn.akamaized.net/m/780x1132/products/27713/27712255/images/res_67e26b152af28c42c1b4e37b8aebfed3.jpg?s=2f5wOCRisKlJ https://fdcdn.akamaized.net/m/780x1132/products/27713/27712255/images/res_89f1ce3274b1db481c331566ef677a64.jpg?s=ldsZlfFlZ9NY https://fdcdn.akamaized.net/m/780x1132/products/27713/27712255/images/res_ee85a1e4a5c96bb64f33c1c89af8fc55.jpg?s=vF8I9smYk74f https://fdcdn.akamaized.net/m/780x1132/products/27713/27712255/images/res_a607c326b4b43e7e248e62f4850521a6.jpg?s=BY72glC9bmf6,katonai zöld,W0GK1N-K9QP0-G8U4,Leírás Szín: katonai zöld Stílus: alkalmi$ elegáns Anyag: csipke Minta: nincs Szabás: testre simuló Hossz: maxi Nyakkivágás: amerikai - magasan záródó$ pántos Ujjak hossza: ujjatlan Részletek: hasítékok az oldalán Összetétel Anyag: 90% poliamid$ 10% elasztán Modellinformáció A modell S-es méretű terméket visel. Méretei: magasság: 180 cm$ mellbőség: 86 cm$ derékbőség: 65 cm$ csípő: 94 cm Termékszám W0GK1N-K9QP0-G8U4
women,dress,dress,női,ruha,ruha,2665563,https://www.fashiondays.hu/v/2665563/n%C5%91i-/ruh%C3%A1zat?productSlug=ejtett-v%C3%A1ll%C3%BA-miniruha-n%C5%91i-guess-jeans&tagId=1,https://www.fashiondays.hu/p/ejtett-v%C3%A1ll%C3%BA-miniruha-n%C5%91i-guess-jeans-p2665563-1/,Ejtett vállú miniruha,27299,76.44,GUESS JEANS,in_stock,https://fdcdn.akamaized.net/m/780x1132/products/27713/27712232/images/res_919bf80aae049920d97bc9a664a01db9.jpg?s=SHmS5FNdTbsk https://fdcdn.akamaized.net/m/780x1132/products/27713/27712232/images/res_1cc3a722230872866bfb56c381abae66.jpg?s=MlHyCZaDhCnA https://fdcdn.akamaized.net/m/780x1132/products/27713/27712232/images/res_674c55b97c0f50d89147d4982829f848.jpg?s=Ic7KVhohKN9q https://fdcdn.akamaized.net/m/780x1132/products/27713/27712232/images/res_37bfd511971218d9ad4e40adaf2409b6.jpg?s=OiOfVCmhha-G,fekete,W0GK1J-WCTR0-JBLK,Leírás Szín: fekete Stílus: hétköznapi$ alkalmi Anyag: pamut Minta: nincs Fazon: ejtett vállú Hossza: mini Nyakkivágás: egyenes Ujjak hossza: középhosszú Összetétel Anyag: 100% pamut Modellinformáció A modell S-es méretű terméket visel. Méretei: magasság: 180 cm$ mellbőség: 86 cm$ derékbőség: 65 cm$ csípő: 94 cm Termékszám W0GK1J-WCTR0-JBLK
women,dress,dress,női,ruha,ruha,2666855,https://www.fashiondays.hu/v/2666855/n%C5%91i-/ruh%C3%A1zat?productSlug=a-vonal%C3%BA-miniruha-puffos-ujjakkal-n%C5%91i-motivi&tagId=1,https://www.fashiondays.hu/p/a-vonal%C3%BA-miniruha-puffos-ujjakkal-n%C5%91i-motivi-p2666855-1/,A-vonalú miniruha puffos ujjakkal,25299,70.84,Motivi,in_stock,https://fdcdn.akamaized.net/m/780x1132/products/29374/29373548/images/res_0f1f8d0d5dc8e5fac0772ab3cb1dac78.jpg?s=ED5MMu5Csv_a https://fdcdn.akamaized.net/m/780x1132/products/29374/29373548/images/res_ce27df9da2a6e1628145b711de8a9b77.jpg?s=x_7ijpEdCsS-,fekete,7093Q101US-33,Leírás Szín: fekete Stílus: elegáns Anyag: szintetikus anyag$ pamut Minta: nincs Szabás: A-vonalú Hossza: mini Nyakkivágás: V-alakú Ujjak: puffosak Ujjak hossza: hosszú Részletek: öv a derékrészen Összetétel Anyag: 60% pamut$ 33% poliészter$ 7% elasztán Termékszám 7093Q101US-33
women,dress,dress,női,ruha,ruha,2665431,https://www.fashiondays.hu/v/2665431/n%C5%91i-/ruh%C3%A1zat?productSlug=ejtett-v%C3%A1ll%C3%BA-miniruha-vir%C3%A1gmint%C3%A1val-n%C5%91i-guess-jeans&tagId=1,https://www.fashiondays.hu/p/ejtett-v%C3%A1ll%C3%BA-miniruha-vir%C3%A1gmint%C3%A1val-n%C5%91i-guess-jeans-p2665431-1/,Ejtett vállú miniruha virágmintával,38599,108.08,GUESS JEANS,in_stock,https://fdcdn.akamaized.net/m/780x1132/products/27713/27712292/images/res_3cb5ab85857768ae9dfe3ffd24290491.jpg?s=7Ut0YGpHZ7nI https://fdcdn.akamaized.net/m/780x1132/products/27713/27712292/images/res_38539049e733d4a9ffdb919b246c463e.jpg?s=bc_mXk7PhLXX https://fdcdn.akamaized.net/m/780x1132/products/27713/27712292/images/res_1259bb52bf529831b7aa8b989762d1b3.jpg?s=y3lBDCPm4s5E https://fdcdn.akamaized.net/m/780x1132/products/27713/27712292/images/res_3f9ed03edb0c883c3ed26bc65c46dbff.jpg?s=g2Oz6WpPpO5F,bézs?rózsaszín?zöld,W0GK52-WCU10-P68A,Leírás Szín: bézs$ rózsaszín$ zöld Stílus: hétköznapi Anyag: pamut Minta: virágminta Szabás: bővülő$ ejtett vállú Hossza: mini Nyakkivágás: egyenes Ujjak hossza: rövid Összetétel Anyag: 100% pamut Modellinformáció A modell S-es méretű terméket visel. Méretei: magasság: 180 cm$ mellbőség: 86 cm$ derékbőség: 65 cm$ csípő: 94 cm Termékszám W0GK52-WCU10-P68A
women,dress,dress,női,ruha,ruha,2676489,https://www.fashiondays.hu/v/2676489/n%C5%91i-/ruh%C3%A1zat?productSlug=log%C3%B3s-ujjatlan-ruha-n%C5%91i-champion&tagId=1,https://www.fashiondays.hu/p/log%C3%B3s-ujjatlan-ruha-n%C5%91i-champion-p2676489-1/,Logós ujjatlan ruha,9299,26.04,Champion,in_stock,https://fdcdn.akamaized.net/m/780x1132/products/30000/29999056/images/res_540a2841b05a2843d3fcba22678e03c1.jpg?s=iHXaCBUx33uT https://fdcdn.akamaized.net/m/780x1132/products/30000/29999056/images/res_f775872de44fac7632a65a0283c841a0.jpg?s=05aMru_Qch12 https://fdcdn.akamaized.net/m/780x1132/products/30000/29999056/images/res_e1214a088f021ba848992203e4fe3156.jpg?s=NCvyijLZ9E1L,világosszürke,112610-EM029,Leírás Szín: világosszürke Stílus: hétköznapi Anyag: pamut Minta: logós Szabás: egyenes Hossza: midi Nyakkivágás: kerek Ujjak hossza: ujjatlan Részletek: hasíték a hátoldalán Összetétel Anyag: 100% pamut Termékszám 112610-EM029
women,dress,dress,női,ruha,ruha,2671287,https://www.fashiondays.hu/v/2671287/n%C5%91i-/ruh%C3%A1zat?productSlug=lentartalm%C3%BA-v-nyak%C3%BA-ruha-n%C5%91i-gap&tagId=1,https://www.fashiondays.hu/p/lentartalm%C3%BA-v-nyak%C3%BA-ruha-n%C5%91i-gap-p2671287-1/,Lentartalmú V-nyakú ruha,15399,43.12,GAP,in_stock,https://fdcdn.akamaized.net/m/780x1132/products/29809/29808741/images/res_065faf834afc8bc7d8c9ec8e9061c537.jpg?s=G1PemJY0Ni59 https://fdcdn.akamaized.net/m/780x1132/products/29809/29808741/images/res_1a81b69f594662a585b56b235279aa3e.jpg?s=jaCSLMaeXLQS https://fdcdn.akamaized.net/m/780x1132/products/29809/29808741/images/res_4383286fa4b9f5dcb0e0799a816912d2.jpg?s=4wqIweDd9IfE https://fdcdn.akamaized.net/m/780x1132/products/29809/29808741/images/res_f39e2abc88066135eb4793c4e6651b62.jpg?s=96RrybSp61C0 https://fdcdn.akamaized.net/m/780x1132/products/29809/29808741/images/res_c2392bf8457db8c35480bbd3d9233bd5.jpg?s=OmJJjKmSorJN,világoskék,000541669-626,Leírás Szín: világoskék Stílus: hétköznapi Anyag: pamut$ lenvászon Minta: nincs Szabás: bővülő Hossza: mini Nyakkivágás: V alakú Ujjak hossza: rövid Rögzítés: gombos Összetétel Anyag: 55% len$ 45% pamut Termékszám 000541669-626
women,dress,dress,női,ruha,ruha,2664168,https://www.fashiondays.hu/v/2664168/n%C5%91i-/ruh%C3%A1zat?productSlug=willow-mod%C3%A1ltartalm%C3%BA-p%C3%B3l%C3%B3ruha-n%C5%91i-only&tagId=1,https://www.fashiondays.hu/p/willow-mod%C3%A1ltartalm%C3%BA-p%C3%B3l%C3%B3ruha-n%C5%91i-only-p2664168-1/,Willow modáltartalmú pólóruha,9599,26.88,Only,in_stock,https://fdcdn.akamaized.net/m/780x1132/products/29293/29292577/images/res_dad2fca390e34c9caf3b13452c317947.jpg?s=cpuNVQvMgUQj https://fdcdn.akamaized.net/m/780x1132/products/29293/29292583/images/res_66f887e68ab55cf9e2861f27dd2ec0cc.jpg?s=mfN_oFOmnUq4 https://fdcdn.akamaized.net/m/780x1132/products/29293/29292583/images/res_7d2115d7b653ad23be2621bd2c59f9f8.jpg?s=tTOgiaAyy4m7,téglavörös,15204297-HOT-SAUCE,Leírás Szín: téglavörös Stílus: hétköznapi Anyag: szintetikus anyag$ modál Minta: nincs Szabás: egyenes Hossza: midi Nyakkivágás: kerek Ujjak hossza: rövid Részletek: puha anyag Összetétel Anyag: 71% Tencel modál$ 29% poliészter Modellinformáció A modell S-es méretű terméket visel. Méretei: 180 cm$ mellbőség: 86 cm$ derékbőség: 65 cm$ csípő: 94 cm Termékszám 15204297-HOT-SAUCE
women,dress,dress,női,ruha,ruha,2682646,https://www.fashiondays.hu/v/2682646/n%C5%91i-/ruh%C3%A1zat?productSlug=%C3%81tlapol%C3%B3s-ruha-megk%C3%B6t%C5%91s-der%C3%A9kr%C3%A9sszel-n%C5%91i-liu-jo&tagId=1,https://www.fashiondays.hu/p/%C3%81tlapol%C3%B3s-ruha-megk%C3%B6t%C5%91s-der%C3%A9kr%C3%A9sszel-n%C5%91i-liu-jo-p2682646-1/,Átlapolós ruha megkötős derékrésszel,42699,119.56,Liu Jo,limited_quantity,https://fdcdn.akamaized.net/m/780x1132/products/30045/30044008/images/res_880599fe310337808c90c79b348259a3.jpg?s=fzmYO6Isxina https://fdcdn.akamaized.net/m/780x1132/products/30045/30044008/images/res_b4030c1130455718f0c3f1fdb06a0198.jpg?s=pnDKa7PrVslD https://fdcdn.akamaized.net/m/780x1132/products/30045/30044008/images/res_75a14f8c577b94f60df427aec454a059.jpg?s=2WutOXvamykF,tevebarna?fekete,CA0114-T2378-U9859,Leírás Szín: tevebarna$ fekete Stílus: hétköznapi Anyag: szintetikus szálak Minta: állatmintás Részletek: átlapolós Hossza: mini Nyakkivágás: V-alakú Ujjak hossza: háromnegyedes Részletek: megkötő a derékrészen Összetétel Anyag: 100% poliészter Termékszám CA0114-T2378-U9859
women,dress,dress,női,ruha,ruha,2683839,https://www.fashiondays.hu/v/2683839/n%C5%91i-/ruh%C3%A1zat?productSlug=miniruha-csipkebet%C3%A9tekkel-n%C5%91i-only&tagId=1,https://www.fashiondays.hu/p/miniruha-csipkebet%C3%A9tekkel-n%C5%91i-only-p2683839-1/,Miniruha csipkebetétekkel,19499,54.6,Only,in_stock,https://fdcdn.akamaized.net/m/780x1132/products/30046/30045495/images/res_bfff8e505ec3e1042f6dc868f505e9a4.jpg?s=wK9xRANfRy_Z https://fdcdn.akamaized.net/m/780x1132/products/30046/30045495/images/res_e54cb5da082e51aefad6259977bc45b2.jpg?s=mNOvGxkbwn-f https://fdcdn.akamaized.net/m/780x1132/products/30046/30045495/images/res_88ccbdabf2dcc4972f1d1bb4c6596acf.jpg?s=KC-VAkBduank https://fdcdn.akamaized.net/m/780x1132/products/30046/30045495/images/res_87c305e405abbc2c920ed1e33c7cf2e1.jpg?s=wdq-cz0kJV-7 https://fdcdn.akamaized.net/m/780x1132/products/30046/30045495/images/res_e4bde2197184548fb95f9925d1167753.jpg?s=7JTcnxGKPD45 https://fdcdn.akamaized.net/m/780x1132/products/30046/30045495/images/res_98500e3f166f899eed5dd5b1f0efce81.jpg?s=v7euodqTgUBb https://fdcdn.akamaized.net/m/780x1132/products/30046/30045495/images/res_d77588ce5e88f9c5a9f213b3761a6afa.jpg?s=zo_Miatyf29B https://fdcdn.akamaized.net/m/780x1132/products/30046/30045495/images/res_72528a4a119f90031ebf449420dd6406.jpg?s=EghpKU3AUukg,fekete,15204605-BLACK,Leírás Szín: fekete Stílus: elegáns Anyag: pamut$ csipke$ szintetikus szálak Minta: nincs Szabás: bővülő Hossza: mini Gallér: rövid Ujjak hossza: rövid Rögzítés: gombos Összetétel Anyag: 44% nylon$ 37% pamut$ 17% viszkóz$ 2% lyocell Termékszám 15204605-BLACK
women,dress,dress,női,ruha,ruha,2665501,https://www.fashiondays.hu/v/2665501/n%C5%91i-/ruh%C3%A1zat?productSlug=bodycon-midiruha-nyakba-akaszt%C3%B3s-diz%C3%A1jnnal-n%C5%91i-guess-jeans&tagId=1,https://www.fashiondays.hu/p/bodycon-midiruha-nyakba-akaszt%C3%B3s-diz%C3%A1jnnal-n%C5%91i-guess-jeans-p2665501-1/,Bodycon midiruha nyakba akasztós dizájnnal,34999,98,GUESS JEANS,in_stock,https://fdcdn.akamaized.net/m/780x1132/products/27713/27712264/images/res_008a2cc3a842779536811580ed665993.jpg?s=G7cjllD5dvNq https://fdcdn.akamaized.net/m/780x1132/products/27713/27712264/images/res_10f9a0e34166287caec93d8a427115ec.jpg?s=EdlfpL7BfmGx https://fdcdn.akamaized.net/m/780x1132/products/27713/27712264/images/res_8022ba48dbe738a604aaa1576cd08d70.jpg?s=oDGNApghc3on https://fdcdn.akamaized.net/m/780x1132/products/27713/27712266/images/res_78a7e8bd0a28faafcf75b575063425f0.jpg?s=X9Tnpm8CwNqv,fekete,W0GK2C-Z2NT0-JBLK,Leírás Szín: fekete Stílus: alkalmi$ elegáns Anyag: viszkóz Minta: nincs Fazon: bodycon - testet követő$ szűkített fazon Hossza: midi Nyakrész: nyakba akasztós dizájn Ujjak hossza: ujjatlan Összetétel Anyag: 87% viszkóz$ 12% poliamid$ 1% poliészter Modellinformáció A modell S-es méretű terméket visel. Méretei: magasság: 180 cm$ mellbőség: 86 cm$ derékbőség: 65 cm$ csípő: 94 cm Termékszám W0GK2C-Z2NT0-JBLK
women,dress,dress,női,ruha,ruha,2682650,https://www.fashiondays.hu/v/2682650/n%C5%91i-/ruh%C3%A1zat?productSlug=sz%C5%B1k%C3%ADtett-fazon%C3%BA-ruha-sz%C3%ADves-mint%C3%A1val-n%C5%91i-liu-jo&tagId=1,https://www.fashiondays.hu/p/sz%C5%B1k%C3%ADtett-fazon%C3%BA-ruha-sz%C3%ADves-mint%C3%A1val-n%C5%91i-liu-jo-p2682650-1/,Szűkített fazonú ruha szíves mintával,36999,103.6,Liu Jo,limited_quantity,https://fdcdn.akamaized.net/m/780x1132/products/30045/30044123/images/res_d9e5a0602d327da632a508da8f63ec0e.jpg?s=rqKAOR6G599I https://fdcdn.akamaized.net/m/780x1132/products/30045/30044123/images/res_cf9c81672e4069eb75f5e7dcada2faa3.jpg?s=MHZiaIwpQsKt https://fdcdn.akamaized.net/m/780x1132/products/30045/30044123/images/res_2d912e7d24d4452e3a88add80e663992.jpg?s=Z0Ef24qwuCt5 https://fdcdn.akamaized.net/m/780x1132/products/30045/30044123/images/res_0ca9a4277a01cca24d6b68091f3c669b.jpg?s=oUmr2pqEl5mt,fekete?piros?fehér,PA0099-T5869-09T07,Leírás Szín: fekete$ piros$ fehér Stílus: hétköznapi Anyag: viszkóz Minta: van Fazon: szűkített Hossza: mini Nyakkivágás: V-alakú Ujjak hossza: hosszú Részletek: húzott részletek$ levehető megkötő a derékrészen Összetétel Anyag: 100% viszkóz Termékszám PA0099-T5869-09T07
women,dress,dress,női,ruha,ruha,2682641,https://www.fashiondays.hu/v/2682641/n%C5%91i-/ruh%C3%A1zat?productSlug=plisz%C3%ADrozott-maxiruha-csill%C3%A1mos-hat%C3%A1ssal-n%C5%91i-liu-jo&tagId=1,https://www.fashiondays.hu/p/plisz%C3%ADrozott-maxiruha-csill%C3%A1mos-hat%C3%A1ssal-n%C5%91i-liu-jo-p2682641-1/,Pliszírozott maxiruha csillámos hatással,34599,96.88,Liu Jo,limited_quantity,https://fdcdn.akamaized.net/m/780x1132/products/30045/30044091/images/res_83d5071aae4466f1b95ca869e3fec311.jpg?s=3UPVMtN9E8v6 https://fdcdn.akamaized.net/m/780x1132/products/30045/30044091/images/res_8c4aa3b794d99026112d08ea2e1f79bb.jpg?s=8uVtPBzscIOj https://fdcdn.akamaized.net/m/780x1132/products/30045/30044091/images/res_afc8b99e8755765d4cc3eb2ca245a41e.jpg?s=M2tk6jmUT-rn,sötétszürke,MA0041-MA32H-04858,Leírás Szín: sötétszürke Stílus: hétköznapi$ elegáns Anyag: viszkóz$ szintetikus szálak Minta: nincs Szabás: bővülő$ átlapolós Hossz: maxi Nyakkivágás: átlapolós V-kivágás Ujjak hossza: ujjatlan Részletek: csillámos hatás$ pliszírozott Összetétel Anyag: 78% viszkóz$ 22% poliészter Termékszám MA0041-MA32H-04858
women,dress,dress,női,ruha,ruha,2666218,https://www.fashiondays.hu/v/2666218/n%C5%91i-/ruh%C3%A1zat?productSlug=strandruha-oldalhas%C3%ADt%C3%A9kokkal-n%C5%91i-marks-spencer&tagId=1,https://www.fashiondays.hu/p/strandruha-oldalhas%C3%ADt%C3%A9kokkal-n%C5%91i-marks-spencer-p2666218-1/,Strandruha oldalhasítékokkal,11699,32.76,Marks & Spencer,in_stock,https://fdcdn.akamaized.net/m/780x1132/products/29541/29540936/images/res_8d5051ba928c763d396bdd38832fbfe6.jpg?s=egaIu6HnPX11 https://fdcdn.akamaized.net/m/780x1132/products/29541/29540936/images/res_352d024b9b60f30d5470fb974cf95b5d.jpg?s=Sk6tcq53OhCd https://fdcdn.akamaized.net/m/780x1132/products/29541/29540936/images/res_510512281cdd21ece14aefd07faead1f.jpg?s=RW0XAMNup9Go https://fdcdn.akamaized.net/m/780x1132/products/29541/29540936/images/res_f3cc9111a50003c39ab937cf20505f6a.jpg?s=TSCAz8Eoeuff https://fdcdn.akamaized.net/m/780x1132/products/29541/29540936/images/res_4ac762f92f9f1699352b3bd2e2f69d76.jpg?s=6DO526FktbJj,színes,T52-7618-N4,Leírás Szín: színes Stílus: strand Anyag: szintetikus szálak Minta: csíkos Szabás: egyenes Hossza: mini Nyakkivágás: V-alakú Ujjak hossza: ujjatlan Összetétel Anyag: 83% poliamid$ 17% elasztán Termékszám T52-7618-N4
women,dress,dress,női,ruha,ruha,2665894,https://www.fashiondays.hu/v/2665894/n%C5%91i-/ruh%C3%A1zat?productSlug=lentartalm%C3%BA-cs%C3%ADkos-ruha-n%C5%91i-marks-spencer&tagId=1,https://www.fashiondays.hu/p/lentartalm%C3%BA-cs%C3%ADkos-ruha-n%C5%91i-marks-spencer-p2665894-1/,Lentartalmú csíkos ruha,11699,32.76,Marks & Spencer,in_stock,https://fdcdn.akamaized.net/m/780x1132/products/29541/29540780/images/res_ef85054589fa544de3504ebefcd59749.jpg?s=uKlKQ6XDPEte https://fdcdn.akamaized.net/m/780x1132/products/29541/29540780/images/res_7927b77dbfb6f8b5918117b459c72bf3.jpg?s=aEvF-E-vlUwE,lila?fehér,T42-7671-G4,Leírás Színe: lila$ fehér Stílus: hétköznapi Anyag: viszkóz$ lenvászon Minta: csíkos Szabás: egyenes Hossza: mini Nyakkivágás: kerek$ V-hasítékkal Ujjak hossza: ujjatlan Technológia: Cool Comfort™ Összetétel Anyag: 53% len$ 47% viszkóz Termékszám T42-7671-G4
women,dress,dress,női,ruha,ruha,2665523,https://www.fashiondays.hu/v/2665523/n%C5%91i-/ruh%C3%A1zat?productSlug=tr%C3%B3pusi-mint%C3%A1s-hossz%C3%BA-fazon%C3%BA-ruha-n%C5%91i-guess-jeans&tagId=1,https://www.fashiondays.hu/p/tr%C3%B3pusi-mint%C3%A1s-hossz%C3%BA-fazon%C3%BA-ruha-n%C5%91i-guess-jeans-p2665523-1/,Trópusi mintás hosszú fazonú ruha,46499,130.2,GUESS JEANS,in_stock,https://fdcdn.akamaized.net/m/780x1132/products/27713/27712185/images/res_71baeb623a5b0ee8aa8eef5ed0fdb4b5.jpg?s=w6yONNKlih9T https://fdcdn.akamaized.net/m/780x1132/products/27713/27712185/images/res_5e8e2bb3a900b1449c9f8265efff627d.jpg?s=2mYjrNX46vVt https://fdcdn.akamaized.net/m/780x1132/products/27713/27712185/images/res_bad2a455c3119f05320c01e51264b74b.jpg?s=W_YTIUxCB3dG https://fdcdn.akamaized.net/m/780x1132/products/27713/27712185/images/res_88e13bedf98196e58df563cdfdd4dd7f.jpg?s=EHj3MqIWOLcU,színes,W0GK0Y-WA4K0-P57B,Leírás Szín: színes Stílus: hétköznapi Anyag: szintetikus Minta: trópusi minta Szabás: bővülő Hossz: hosszú Nyakkivágás: V-alakú Pántok: spagetti Ujjak hossza: ujjatlan Részletek: kivágások hátul$ hajtások Rögzítés: cipzáros Összetétel Anyag: 100% poliészter Modellinformáció A modell S (=40) méretű terméket visel$ olasz méretezés szerint. Méretei: magasság: 180 cm$ mellbőség: 86 cm$ derékbőség: 65 cm$ csípő: 94 cm Termékszám W0GK0Y-WA4K0-P57B
women,dress,dress,női,ruha,ruha,2665512,https://www.fashiondays.hu/v/2665512/n%C5%91i-/ruh%C3%A1zat?productSlug=bodycon-miniruha-n%C5%91i-guess-jeans&tagId=1,https://www.fashiondays.hu/p/bodycon-miniruha-n%C5%91i-guess-jeans-p2665512-1/,Bodycon miniruha,35199,98.56,GUESS JEANS,in_stock,https://fdcdn.akamaized.net/m/780x1132/products/27713/27712202/images/res_ba36be3fa001c53a83bf148b30ff0c25.jpg?s=ksDlk7VLaIeM https://fdcdn.akamaized.net/m/780x1132/products/27713/27712202/images/res_1786068731a7baff4f40c5fdfa90535f.jpg?s=fzU9Sk7Xyryp https://fdcdn.akamaized.net/m/780x1132/products/27713/27712202/images/res_23575ad68bd345aca0eed25263d12dbc.jpg?s=cLHH9UOg2V_a https://fdcdn.akamaized.net/m/780x1132/products/27713/27712202/images/res_9acd28beccec18dc66082af2342ddf19.jpg?s=DAzsk2029QsQ,fekete,W0GK18-Z2D10-JBLK,Leírás Szín: fekete Stílus: alkalmi$ elegáns Anyag: viszkóz$ szintetikus szálak Minta: nincs Fazon: bodycon - testet követő$ szűkített fazon Hossza: mini Nyakkivágás: kerek Ujjak hossza: rövid Összetétel Anyag: 51% viszkóz$ 46% poliamid$ 3% elasztán Modellinformáció A modell S-es méretű terméket visel. Méretei: magasság: 180 cm$ mellbőség: 86 cm$ derékbőség: 65 cm$ csípő: 94 cm Termékszám W0GK18-Z2D10-JBLK
women,dress,dress,női,ruha,ruha,2665485,https://www.fashiondays.hu/v/2665485/n%C5%91i-/ruh%C3%A1zat?productSlug=ejtett-v%C3%A1ll%C3%BA-tr%C3%B3pusi-mint%C3%A1s-miniruha-n%C5%91i-guess-jeans&tagId=1,https://www.fashiondays.hu/p/ejtett-v%C3%A1ll%C3%BA-tr%C3%B3pusi-mint%C3%A1s-miniruha-n%C5%91i-guess-jeans-p2665485-1/,Ejtett vállú trópusi mintás miniruha,33199,92.96,GUESS JEANS,in_stock,https://fdcdn.akamaized.net/m/780x1132/products/27713/27712159/images/res_33b590ce0352d5a842f30b88a7854482.jpg?s=LQD0zuYf_PXx https://fdcdn.akamaized.net/m/780x1132/products/27713/27712159/images/res_f9ff727154085176d0c5e1668f7abe32.jpg?s=DfEQcU-iVHf0 https://fdcdn.akamaized.net/m/780x1132/products/27713/27712159/images/res_31d4553974c3d41210d03a7a2819b486.jpg?s=8WEyfgxDP5A1 https://fdcdn.akamaized.net/m/780x1132/products/27713/27712159/images/res_a6c4918f9f44efbb0c9b5abac105001e.jpg?s=PT6wvgzvc-P3,színes,W0GK0T-WCUV0-P57B,Leírás Szín: színes Stílus: hétköznapi Anyag: szintetikus anyag$ pamut Minta: trópusi minta Fazon: ejtett vállú Hossza: mini Nyakkivágás: szív alakú Ujjak hossza: rövid Részletek: fodros részletek Rögzítés: cipzáros Összetétel Anyag: 68% pamut$ 29% poliészter$ 3% elasztán Modellinformáció A modell S (=40) méretű terméket visel$ olasz méretezés szerint. Méretei: magasság: 180 cm$ mellbőség: 86 cm$ derékbőség: 65 cm$ csípő: 94 cm Termékszám W0GK0T-WCUV0-P57B
women,dress,dress,női,ruha,ruha,2665442,https://www.fashiondays.hu/v/2665442/n%C5%91i-/ruh%C3%A1zat?productSlug=vir%C3%A1gmint%C3%A1s-%C3%A1tlapol%C3%B3s-fazon%C3%BA-miniruha-n%C5%91i-guess-jeans&tagId=1,https://www.fashiondays.hu/p/vir%C3%A1gmint%C3%A1s-%C3%A1tlapol%C3%B3s-fazon%C3%BA-miniruha-n%C5%91i-guess-jeans-p2665442-1/,Virágmintás átlapolós fazonú miniruha,29899,83.72,GUESS JEANS,in_stock,https://fdcdn.akamaized.net/m/780x1132/products/27713/27712121/images/res_ebc00f19c1d0854dd522066abffbab41.jpg?s=FzIzY8qY1HVW https://fdcdn.akamaized.net/m/780x1132/products/27713/27712121/images/res_2d84ee32c493311710d4e2ef0a64eca3.jpg?s=UmW7MyX9jGNG https://fdcdn.akamaized.net/m/780x1132/products/27713/27712121/images/res_583238e2db9164fa18f8a76e6b1f5086.jpg?s=-sOWQ2LFg6oJ,fehér?rózsaszín?zöld,W0GK0K-WCUN0-P68B,Leírás Szín: fehér$ rózsaszín$ zöld Stílus: hétköznapi Anyag: szintetikus Minta: virágminta Részletek: átlapolós Hossza: mini Nyakkivágás: V-alakú Pánt: állítható Ujjak hossza: ujjatlan Részlet: dekoratív gombok Rögzítés: cipzáros Összetétel Anyag: 100% poliészter Modellinformáció A modell S (=40) méretű terméket visel$ olasz méretezés szerint. Méretei: magasság: 180 cm$ mellbőség: 86 cm$ derékbőség: 65 cm$ csípő: 94 cm Termékszám W0GK0K-WCUN0-P68B
women,dress,dress,női,ruha,ruha,2665419,https://www.fashiondays.hu/v/2665419/n%C5%91i-/ruh%C3%A1zat?productSlug=bodycon-miniruha-n%C5%91i-guess-jeans&tagId=1,https://www.fashiondays.hu/p/bodycon-miniruha-n%C5%91i-guess-jeans-p2665419-1/,Bodycon miniruha,35199,98.56,GUESS JEANS,in_stock,https://fdcdn.akamaized.net/m/780x1132/products/27713/27712198/images/res_7f476fb6b661097c6fc2e44a94c56e55.jpg?s=h2V3yDaqVVrn https://fdcdn.akamaized.net/m/780x1132/products/27713/27712198/images/res_2c4005218ad3216ed25677fa4067aa1f.jpg?s=h6QyWXRK7CzT https://fdcdn.akamaized.net/m/780x1132/products/27713/27712198/images/res_0798263531bb9912902a66c06f1dd0a5.jpg?s=gGKwe45Jand7 https://fdcdn.akamaized.net/m/780x1132/products/27713/27712198/images/res_828824a820ab4f94f65dbd565d69600a.jpg?s=9L52xi5VPup9,lazacszín,W0GK18-Z2D10-G60L,Leírás Szín: lazacszín Stílus: alkalmi$ elegáns Anyag: viszkóz$ szintetikus szálak Minta: nincs Fazon: bodycon - testet követő$ szűkített fazon Hossza: mini Nyakkivágás: kerek Ujjak hossza: rövid Összetétel Anyag: 51% viszkóz$ 46% poliamid$ 3% elasztán Modellinformáció A modell S-es méretű terméket visel. Méretei: magasság: 180 cm$ mellbőség: 86 cm$ derékbőség: 65 cm$ csípő: 94 cm Termékszám W0GK18-Z2D10-G60L
